titulo,direccion,precio,operacion,barrio,dormitorios,banos,metros,url
UNA CASA ESTILO CAMPO EN LA CIUDAD !!,Venancio Benavidez y Arapey,U$S 225.000,Venta,Prado,2 dormitorios,2 Baños,130 Mts,https://www.gallito.com.uy/una-casa-estilo-campo-en-la-ciudad-inmuebles-27548626
Apartamento Venta Malvin Norte Montevideo iMas.uy G *...,Camino Carrasco y Piran,U$S 72.000,Venta,Malvin Norte,2 dormitorios,1 Baños,72 Mts,https://www.gallito.com.uy/apartamento-venta-malvin-norte-montevideo-imasuy-g-inmuebles-27399020
VENTA APTO P. CARRETAS 3 DOR - 2 BAÑOS- GARAJE,21 de setiembre y -,U$S 289.000,Venta,Punta Carretas,3 dormitorios,2 Baños,90 Mts,https://www.gallito.com.uy/venta-apto-p-carretas-3-dor-2-baños-garaje-inmuebles-27379099
Venta Penthouse 2 dormitorios en Pocitos  con amplia terraz,Gabriel Pereira y Libertad,U$S 319.000,Venta,Pocitos,2 dormitorios,2 Baños,134 Mts,https://www.gallito.com.uy/venta-penthouse-2-dormitorios-en-pocitos-con-amplia-terraz-inmuebles-27478533
EXCELENTE OPORTUNIDAD !! AMPLIO APTO CON COCHERA Y AMENITIES,Juan José Arteaga y Reyes,U$S 218.000,Venta,Prado,3 dormitorios,2 Baños,107 Mts,https://www.gallito.com.uy/excelente-oportunidad-amplio-apto-con-cochera-y-amenities-inmuebles-26385575
"Hermoso apartamento en venta, no dude en llamar!!",Av Libertador Bríg. General Lavalleja y Nicaragua,U$S 245.000,Venta,Aguada,3 dormitorios,2 Baños,130 Mts,https://www.gallito.com.uy/hermoso-apartamento-en-venta-no-dude-en-llamar-inmuebles-25768873
"Apartamento En Venta, 1 Dormitorio, Tres Cruces, Piso 12",Av. 8 de Octubre y Av. Italia,U$S 142.000,Venta,Tres Cruces,1 dormitorio,1 Baños,45 Mts,https://www.gallito.com.uy/apartamento-en-venta-1-dormitorio-tres-cruces-piso-12-inmuebles-26779506
"Venta con renta de oficina/studio en Pocitos Nuevo, 5 garaje",Luis A. de Herrera y Antonio D. Costa,U$S 298.000,Venta,Pocitos,,1 Baños,124 Mts,https://www.gallito.com.uy/venta-con-renta-de-oficinastudio-en-pocitos-nuevo-5-garaje-inmuebles-26233830
Semipiso sobre Juan Ma. Perez esquina Rambla. Todo al Frente,Rambla República del Perú y Juan María Perez,U$S 255.000,Venta,Pocitos,2 dormitorios,2 Baños,81 Mts,https://www.gallito.com.uy/semipiso-sobre-juan-ma-perez-esquina-rambla-todo-al-frente-inmuebles-27401597
Apartamento en venta de 2 dormitorios en Atahualpa,El Iniciador 1628 y Esquina,U$S 80.000,Venta,Atahualpa,2 dormitorios,1 Baños,51 Mts,https://www.gallito.com.uy/apartamento-en-venta-de-2-dormitorios-en-atahualpa-inmuebles-27517755
"Gran lanzamiento, gran predio verde con todos los servicios",Luis A. de Herrera y Sancho Panza,U$S 110.491,Venta,La Blanqueada,1 dormitorio,1 Baños,1 Mts,https://www.gallito.com.uy/gran-lanzamiento-gran-predio-verde-con-todos-los-servicios-inmuebles-26302790
Venta importante local 500 m2 Centro,Cerro Largo esq. Rondeau y . Rondeau,U$S 430.000,Venta,Centro,,Más de 3 baños,576 Mts,https://www.gallito.com.uy/venta-importante-local-500-m2-centro-inmuebles-26802105
Casa de Revista en lo mejor de Punta Gorda,Av San Marino y Ciudad de Paris,U$S 555.000,Venta,Punta Gorda,2 dormitorios,2 Baños,305 Mts,https://www.gallito.com.uy/casa-de-revista-en-lo-mejor-de-punta-gorda-inmuebles-26743821
Edificio MAO,Daniel Muñoz y Defensa,U$S 110.000,Venta,Monoambiente,,1 Baños,39 Mts,https://www.gallito.com.uy/edificio-mao-inmuebles-25820434
Apartamento en venta de 4 dormitorios 2 Garajes y Terraz...,republica del peru 1395 D y Esquina,U$S 640.000,Venta,Pocitos,3 dormitorios,Más de 3 baños,216 Mts,https://www.gallito.com.uy/apartamento-en-venta-de-4-dormitorios-2-garajes-y-terraz-inmuebles-27398311
Venta de apartamento 1 dormitorio FORUM Buceo,Rambla Armenia y Luis A. de Herrera,U$S 290.000,Venta,Puerto Buceo,1 dormitorio,1 Baños,45 Mts,https://www.gallito.com.uy/venta-de-apartamento-1-dormitorio-forum-buceo-inmuebles-27142788
Apartamento en venta de 3 dormitorios en Malvin,Tres Cerros y Esquina,U$S 129.000,Venta,Malvin,3 dormitorios,1 Baños,70 Mts,https://www.gallito.com.uy/apartamento-en-venta-de-3-dormitorios-en-malvin-inmuebles-26346689
Apartamento en Venta - 2 dormitorios - Cordón,Gonzalo Ramírez y Gaboto,U$S 99.000,Venta,Cordon,2 dormitorios,1 Baños,45 Mts,https://www.gallito.com.uy/apartamento-en-venta-2-dormitorios-cordon-inmuebles-27032050
Venta de apartamento en Pocitos BRIO RIVERA,POCITOS,U$S 235.700,Venta,Pocitos,2 dormitorios,2 Baños,98 Mts,https://www.gallito.com.uy/venta-de-apartamento-en-pocitos-brio-rivera-inmuebles-25417521
IMPERIAL VENDE CASA  3DORM PATIO Y DEMAS COMODIDADES,MARTIN C MARTINEZ y GRAL FLORES,U$S 250.000,Venta,Jacinto Vera,3 dormitorios,2 Baños,200 Mts,https://www.gallito.com.uy/imperial-vende-casa-3dorm-patio-y-demas-comodidades-inmuebles-27008296
Amplio 94 m2 4dorm 2 baños garaje para reciclar U$S 197.000,Germán Barbato y 18 de Julio,U$S 197.000,Venta,Centro,4 dormitorios,2 Baños,94 Mts,https://www.gallito.com.uy/amplio-94-m2-4dorm-2-baños-garaje-para-reciclar-uss-197000-inmuebles-25992359
Estrene ya !! c/ Amenities,L.A. Herrera y Joanico,U$S 108.400,Venta,Monoambiente,,1 Baños,33 Mts,https://www.gallito.com.uy/estrene-ya-c-amenities-inmuebles-27479574
Apto contrafrente piso alto muy luminoso con baño y coc nvo,Galeria de LOndon y Rio Negro y Paraguay,U$S 123.000,Venta,Centro,1 dormitorio,1 Baños,60 Mts,https://www.gallito.com.uy/apto-contrafrente-piso-alto-muy-luminoso-con-baño-y-coc-nvo-inmuebles-26911939
"Impecable,  1piso por escalera a nuevo, terrazas, luminoso",Erevan y Av.italia,U$S 168.000,Venta,Malvin Norte,3 dormitorios,1 Baños,84 Mts,https://www.gallito.com.uy/impecable-1piso-por-escalera-a-nuevo-terrazas-luminoso-inmuebles-26889998
Excelente apartamento primera Linea Rambla de Kibon,... y Pocitos Nuevo,U$S 539.000,Venta,Pocitos Nuevo,4 dormitorios,3 Baños,158 Mts,https://www.gallito.com.uy/excelente-apartamento-primera-linea-rambla-de-kibon-inmuebles-27049677
Venta Oficina Ciudad Vieja Vista Al Mar Edificio Pocos Años,"Reconquista 517, 11000 Montevideo y Treinta y tres",U$S 130.000,Venta,Ciudad Vieja,,1 Baños,,https://www.gallito.com.uy/venta-oficina-ciudad-vieja-vista-al-mar-edificio-pocos-años-inmuebles-27486109
Excelente ubicación con Renta!,Dalmiro Costa y Comercio,U$S 80.000,Venta,Buceo,2 dormitorios,1 Baños,39 Mts,https://www.gallito.com.uy/excelente-ubicacion-con-renta-inmuebles-26237721
Venta Apartamento de 3 Dormitorios con Hermosa Vista al des,Próximo al Club de Golf,U$S 255.000,Venta,Parque Rodo,3 dormitorios,1 Baños,63 Mts,https://www.gallito.com.uy/venta-apartamento-de-3-dormitorios-con-hermosa-vista-al-des-inmuebles-25889112
PARQUE BAROFFIO 2 PLANTAS 3DORM 2BAÑOS BARBACOA piscina,FAUSTO y Justino ZAVALA MUNIZ,U$S 335.000,Venta,Punta Gorda,3 dormitorios,2 Baños,120 Mts,https://www.gallito.com.uy/parque-baroffio-2-plantas-3dorm-2baños-barbacoa-piscina-inmuebles-26622513
Venta Apartamento Punta Carretas 1 Dormitorio - Gran Terraza,jose maria Montero 2856 y Miñones,U$S 205.000,Venta,Punta Carretas,1 dormitorio,1 Baños,50 Mts,https://www.gallito.com.uy/venta-apartamento-punta-carretas-1-dormitorio-gran-terraza-inmuebles-26261611
Increíble Oportunidad | Apto de 2 Dormitorios en Malvin,Dr. Declory y 18 de Diciembre,U$S 285.000,Venta,Malvin,2 dormitorios,2 Baños,77 Mts,https://www.gallito.com.uy/increible-oportunidad-apto-de-2-dormitorios-en-malvin-inmuebles-26984263
DUEÑO VENDE Apto2Dorm 2Baños Garage  en Altos del Libertador,MARTIN GARCIA y JOSE L TERRA,U$S 160.000,Venta,Aguada,2 dormitorios,2 Baños,58 Mts,https://www.gallito.com.uy/dueño-vende-apto2dorm-2baños-garage-en-altos-del-libertador-inmuebles-27378970
Hermosa casa con jardín al frente y patio con parrillero!,... y Carrasco,U$S 360.000,Venta,Carrasco,4 dormitorios,3 Baños,230 Mts,https://www.gallito.com.uy/hermosa-casa-con-jardin-al-frente-y-patio-con-parrillero-inmuebles-27245424
"Venta apartamento 1 Dormitorio en Buceo, Montevideo",Av. Rivera y Caracas,U$S 132.300,Venta,Buceo,1 dormitorio,1 Baños,50 Mts,https://www.gallito.com.uy/venta-apartamento-1-dormitorio-en-buceo-montevideo-inmuebles-26917492
Lo más buscado y a mts del Montevideo Shopping,Francisco Anzani y Rivera,U$S 265.000,Venta,Buceo,3 dormitorios,2 Baños,178 Mts,https://www.gallito.com.uy/lo-mas-buscado-y-a-mts-del-montevideo-shopping-inmuebles-24696239
Local Venta Buceo Montevideo iMas.uy - G*...,Comercio y Av Italia,U$S 250.000,Venta,Buceo,,1 Baños,298 Mts,https://www.gallito.com.uy/local-venta-buceo-montevideo-imasuy-g-inmuebles-27547876
"Edificios en Venta, con Renta - Palermo",Palermo,U$S 1,Venta,Palermo,,,,https://www.gallito.com.uy/edificios-en-venta-con-renta-palermo-inmuebles-27112618
A estrenar en Cordón! - OPORTUNIDAD,Brandsen 2024 y Dr.pablo di María y arenal grande,U$S 119.800,Venta,Cordon,1 dormitorio,1 Baños,38 Mts,https://www.gallito.com.uy/a-estrenar-en-cordon-oportunidad-inmuebles-27415546
"Casa en planta baja, prÃ³x a Corrales y Varela",Ref: 511 y Villa Española,U$S 98.000,Venta,Villa Española,2 dormitorios,1 Baños,126 Mts,https://www.gallito.com.uy/casa-en-planta-baja-prã³x-a-corrales-y-varela-inmuebles-27484352
Apartamento en venta de 2 dormitorios en Arroyo Seco,General Luna y Esquina,U$S 136.000,Venta,Arroyo Seco,2 dormitorios,1 Baños,57 Mts,https://www.gallito.com.uy/apartamento-en-venta-de-2-dormitorios-en-arroyo-seco-inmuebles-23337949
"Casa En Venta Padrón Único, 4 Dormitorios, Garaje, Parriller",Jaime Cibils y 8 de Octubre,U$S 225.000,Venta,La Blanqueada,4 dormitorios,2 Baños,140 Mts,https://www.gallito.com.uy/casa-en-venta-padron-unico-4-dormitorios-garaje-parriller-inmuebles-25417536
A nuevo! Apto al frente de 3 dormitorios en zona Prado,L. A de Hererra 4492/102 - Ref: 25 y Prado,U$S 149.000,Venta,Prado,3 dormitorios,1 Baños,70 Mts,https://www.gallito.com.uy/a-nuevo-apto-al-frente-de-3-dormitorios-en-zona-prado-inmuebles-25967619
Apartamento en Venta,"Del Libertador, Avda, y La Paz",U$S 159.500,Venta,Aguada,2 dormitorios,1 Baños,57 Mts,https://www.gallito.com.uy/apartamento-en-venta-inmuebles-23895878
Vendo garaje comodo en Pocitos Nuevo,26 de Marzo 3265 y Buxareo,U$S 18.000,Venta,Pocitos,,,,https://www.gallito.com.uy/vendo-garaje-comodo-en-pocitos-nuevo-inmuebles-25102071
Venta Apartamento  2 dormitorios en Palermo con garaje dobl,Gonzalo Ramirez y Ejido,U$S 231.800,Venta,Palermo,2 dormitorios,1 Baños,79 Mts,https://www.gallito.com.uy/venta-apartamento-2-dormitorios-en-palermo-con-garaje-dobl-inmuebles-25900254
PANORAMICO CON BALCON SOBRE PLAZA INDEPENDENCIA 3 DORM 2 B.,Plaza Independencia 830 y Florida,U$S 185.000,Venta,Ciudad Vieja,3 dormitorios,2 Baños,113 Mts,https://www.gallito.com.uy/panoramico-con-balcon-sobre-plaza-independencia-3-dorm-2-b-inmuebles-26761699
Apto Punta Carretas - 2 Dormitorios + Garaje + Amenities,Solano Garcia y Miñones,U$S 390.000,Venta,Punta Carretas,2 dormitorios,2 Baños,73 Mts,https://www.gallito.com.uy/apto-punta-carretas-2-dormitorios-garaje-amenities-inmuebles-26284172
Venta Apartamento De 2 Dormitorios En Pocitos Nuevo,Francisco Muñoz y Pereira de la Luz,U$S 119.990,Venta,Pocitos Nuevo,2 dormitorios,1 Baños,75 Mts,https://www.gallito.com.uy/venta-apartamento-de-2-dormitorios-en-pocitos-nuevo-inmuebles-26716304
Apartamento en Venta,"8 De Octubre y Crocker, Carlos",U$S 152.000,Venta,Union,2 dormitorios,2 Baños,82 Mts,https://www.gallito.com.uy/apartamento-en-venta-inmuebles-26332629
Ifer&Olivera Bv. Artigas y Millan,Bv. Artigas esq. Millán y s/d,U$S 209.000,Venta,Prado,2 dormitorios,1 Baños,65 Mts,https://www.gallito.com.uy/ifer&olivera-bv-artigas-y-millan-inmuebles-27004660
Vendo Apto. 1 dorm. c/Renta en buena Ubicación,Andes y Colonia,U$S 96.000,Venta,Centro,1 dormitorio,1 Baños,44 Mts,https://www.gallito.com.uy/vendo-apto-1-dorm-crenta-en-buena-ubicacion-inmuebles-26449144
PROXIMO A PONCE Y BOSH. FONDO. BARBACOA. 5 DORM. + SERV...,Doctor Enrique Pouey y Esquina,U$S 750.000,Venta,Parque Batlle,más de 4 dormitorios,Más de 3 baños,405 Mts,https://www.gallito.com.uy/proximo-a-ponce-y-bosh-fondo-barbacoa-5-dorm-serv-inmuebles-25828171
"Casa en la uniÃ³n, 3 dormitorios, garaje, ideal",unión  - Ref: 398 y Union,U$S 198.000,Venta,Union,3 dormitorios,3 Baños,266 Mts,https://www.gallito.com.uy/casa-en-la-uniã³n-3-dormitorios-garaje-ideal-inmuebles-25772421
Venta apartamento Loft en Pocitos Cómodas dimensiones,A pasos del WTC,U$S 165.000,Venta,Monoambiente,,1 Baños,43 Mts,https://www.gallito.com.uy/venta-apartamento-loft-en-pocitos-comodas-dimensiones-inmuebles-27026103
VENTA LOCAL GALPON DEPOSITO SAYAGO MOLINOS DE RAFFO MEJOR Q,Molinos de Raffo y Domingo Torres,U$S 285.000,Venta,Sayago,,1 Baños,200 Mts,https://www.gallito.com.uy/venta-local-galpon-deposito-sayago-molinos-de-raffo-mejor-q-inmuebles-26453396
Dueño Vende - vivienda o inversión,Gral Fausto Aguilar y Paraguay,U$S 89.000,Venta,Aguada,1 dormitorio,1 Baños,40 Mts,https://www.gallito.com.uy/dueño-vende-vivienda-o-inversion-inmuebles-27530428
"Excelente zona,  todo a nuevo!  Amplia luminosa barbacoa",Legrand y Michigan,U$S 335.000,Venta,Malvin,3 dormitorios,3 Baños,200 Mts,https://www.gallito.com.uy/excelente-zona-todo-a-nuevo-amplia-luminosa-barbacoa-inmuebles-27229508
Penthouse con tza de 35 m2 vista pasos Bvar. y Garibaldi!!!,Bvar. Artigas y Garibaldi,U$S 137.000,Venta,Jacinto Vera,1 dormitorio,1 Baños,71 Mts,https://www.gallito.com.uy/penthouse-con-tza-de-35-m2-vista-pasos-bvar-y-garibaldi-inmuebles-23409214
Venta Excelente Local Comercial rentado Pocitos Rivera P,"Rivera 3157, Pocitos",U$S 118.000,Venta,Pocitos,,1 Baños,50 Mts,https://www.gallito.com.uy/venta-excelente-local-comercial-rentado-pocitos-rivera-p-inmuebles-21973076
APARTAMENTO EN VENTA Y ALQUILER CON OPCIÓN A COMPRA EN TORR,BVAR ARTIGAS y LUIS ALBERTO DE HERRERA,U$S 270.389,Venta,Jacinto Vera,2 dormitorios,1 Baños,59 Mts,https://www.gallito.com.uy/apartamento-en-venta-y-alquiler-con-opcion-a-compra-en-torr-inmuebles-25917641
Se Vende llave de Local Gastronómico listo para trabajar,Hipólito Yrigoyen 2462 y Petrona Rosende,U$S 18.000,Venta,Malvin Norte,,1 Baños,,https://www.gallito.com.uy/se-vende-llave-de-local-gastronomico-listo-para-trabajar-inmuebles-27387205
VENTA APARTAMENTO 2 DORMITORIOS A ESTRENAR PRADO SUR,Juan Carlos Blanco y Irigoitia,U$S 165.000,Venta,Prado,2 dormitorios,1 Baños,68 Mts,https://www.gallito.com.uy/venta-apartamento-2-dormitorios-a-estrenar-prado-sur-inmuebles-26016395
"Venta de monoambiente en Ventura GO, Cordón",Acevedo Díaz y Colonia,U$S 103.500,Venta,Monoambiente,,1 Baños,31 Mts,https://www.gallito.com.uy/venta-de-monoambiente-en-ventura-go-cordon-inmuebles-27415397
Torre Arenas una nueva forma de vivir en la Rambla de Malvín,O´Higgins y 18 de Diciembre,U$S 347.000,Venta,Malvin,2 dormitorios,2 Baños,99 Mts,https://www.gallito.com.uy/torre-arenas-una-nueva-forma-de-vivir-en-la-rambla-de-malvin-inmuebles-16147517
Vendo casa en Punta Carretas 4 dormitorios 2 baños garaje.,Obligado y Sarmiento,U$S 349.000,Venta,Punta Carretas,4 dormitorios,2 Baños,81 Mts,https://www.gallito.com.uy/vendo-casa-en-punta-carretas-4-dormitorios-2-baños-garaje-inmuebles-26755985
Dueño vende apartamento 2 dormitorios con cochera,Luis Alberto de Herrera y Labandeira,U$S 147.000,Venta,Brazo Oriental,2 dormitorios,1 Baños,60 Mts,https://www.gallito.com.uy/dueño-vende-apartamento-2-dormitorios-con-cochera-inmuebles-27262425
Casa en  venta 3 dormitorios próximo Nuevo Centro,Cufré  próximo a Nuevo Centro,U$S 150.000,Venta,La Blanqueada,3 dormitorios,1 Baños,80 Mts,https://www.gallito.com.uy/casa-en-venta-3-dormitorios-proximo-nuevo-centro-inmuebles-26958128
Venta o Alquiler de apartamento triplex de 5 dormitorios en,"Único. Triplex frente al Golf con dos parrilleros y estufa a leña, 4 g",U$S 1.900.000,Venta,Golf,más de 4 dormitorios,Más de 3 baños,499 Mts,https://www.gallito.com.uy/venta-o-alquiler-de-apartamento-triplex-de-5-dormitorios-en-inmuebles-24867824
"Casa en venta en Pocitos, emblemática esquina Gran recepción",Bulevar España y Berro,U$S 690.000,Venta,Pocitos,más de 4 dormitorios,Más de 3 baños,500 Mts,https://www.gallito.com.uy/casa-en-venta-en-pocitos-emblematica-esquina-gran-recepcion-inmuebles-14587757
Imperdible - Grandes Vistas - 3 Dorm + Servicio + Gge,Av. Brasil y Santiago Vásquez,U$S 495.000,Venta,Pocitos,3 dormitorios,Más de 3 baños,152 Mts,https://www.gallito.com.uy/imperdible-grandes-vistas-3-dorm-servicio-gge-inmuebles-27469261
Venta apartamento 1 dormitorio amueblado Sarmiento,Sarmiento 2519,U$S 196.000,Venta,Punta Carretas,1 dormitorio,1 Baños,52 Mts,https://www.gallito.com.uy/venta-apartamento-1-dormitorio-amueblado-sarmiento-inmuebles-27402074
Casa en venta + local en Nuevo Paris,Timote y Triunfo,U$S 73.000,Venta,Nuevo Paris,4 dormitorios,1 Baños,200 Mts,https://www.gallito.com.uy/casa-en-venta-local-en-nuevo-paris-inmuebles-27325291
CASATROJA VENTA APTO EN PARQUE BATLLE,BV ARTIGAS y 18 DE JULIO,U$S 235.000,Venta,Parque Batlle,2 dormitorios,2 Baños,60 Mts,https://www.gallito.com.uy/casatroja-venta-apto-en-parque-batlle-inmuebles-26089587
CASATROJA VENTA APTO 4 DORMITORIOS EN PARQUE BATLLE,Isabelino Bosch y Luis Ponce,U$S 700.000,Venta,Parque Batlle,4 dormitorios,3 Baños,217 Mts,https://www.gallito.com.uy/casatroja-venta-apto-4-dormitorios-en-parque-batlle-inmuebles-26761645
Amplio monoambiente céntrico con garage,18 de julio y Paullier,U$S 120.000,Venta,Monoambiente,,1 Baños,50 Mts,https://www.gallito.com.uy/amplio-monoambiente-centrico-con-garage-inmuebles-27002772
Increíble Oportunidad | Apto de 1 Dormitorio a estrenar,Dr. Declory y 18 de Diciembre,U$S 165.000,Venta,Malvin,1 dormitorio,1 Baños,47 Mts,https://www.gallito.com.uy/increible-oportunidad-apto-de-1-dormitorio-a-estrenar-inmuebles-26984095
Venta de apartamento de 2 dormitorios y servicio completo en,Bvar. Artigas e Ibiray,U$S 267.000,Venta,Punta Carretas,3 dormitorios,2 Baños,75 Mts,https://www.gallito.com.uy/venta-de-apartamento-de-2-dormitorios-y-servicio-completo-en-inmuebles-27521661
CASATROJA VENTA CASA PH EN POCITOS NUEVO,Antonio Costa y Pereira de la Luz,U$S 390.000,Venta,Pocitos Nuevo,4 dormitorios,3 Baños,233 Mts,https://www.gallito.com.uy/casatroja-venta-casa-ph-en-pocitos-nuevo-inmuebles-25917531
Apartamento en Venta - Aguada,Hocquart Esquina Justicia - Ref: 57 y Aguada,U$S 85.000,Venta,Aguada,2 dormitorios,1 Baños,55 Mts,https://www.gallito.com.uy/apartamento-en-venta-aguada-inmuebles-27378939
CASATROJA VENTA CASA SOBRE LA RAMBLA,Rambla O`Higgins y Coimbra,U$S 575.000,Venta,Punta Gorda,más de 4 dormitorios,Más de 3 baños,419 Mts,https://www.gallito.com.uy/casatroja-venta-casa-sobre-la-rambla-inmuebles-22232740
CASATROJA VENTA APARTAMENTOS EN OBRA MALVÍN,Rbla. Concepción del Uruguay y Asamblea,U$S 401.967,Venta,Malvin,3 dormitorios,3 Baños,129 Mts,https://www.gallito.com.uy/casatroja-venta-apartamentos-en-obra-malvin-inmuebles-26958353
IMPERIAL VENDE TERRENO CON MEJORAS,,U$S 65.000,Venta,Cerrito,,,300 Mts,https://www.gallito.com.uy/imperial-vende-terreno-con-mejoras-inmuebles-26848298
ESTILO SOBRE  RAMBLA DEL PUERTO DEL BUCEO,RAMBLA y XXX,U$S 450.000,Venta,Puerto Buceo,4 dormitorios,2 Baños,160 Mts,https://www.gallito.com.uy/estilo-sobre-rambla-del-puerto-del-buceo-inmuebles-26831888
"A NUEVO JARDIN CON COCHERA, AZOTEA CON PARRILERO CON MESADA,",Leopardi y Br.José Batlle y Ordoñez,U$S 185.000,Venta,Buceo,2 dormitorios,1 Baños,170 Mts,https://www.gallito.com.uy/a-nuevo-jardin-con-cochera-azotea-con-parrilero-con-mesada-inmuebles-27224454
"Venta Casa Ph de 4 dormitorios, jardín y garage en Carrasco",Nariño y Mones Roses,U$S 367.000,Venta,Carrasco,4 dormitorios,Más de 3 baños,150 Mts,https://www.gallito.com.uy/venta-casa-ph-de-4-dormitorios-jardin-y-garage-en-carrasco-inmuebles-27565030
Apartamento Venta Reducto Montevideo iMas.uy R...,Juan Rodriguez Correa y Guardia Oriental,U$S 142.000,Venta,Reducto,2 dormitorios,1 Baños,99 Mts,https://www.gallito.com.uy/apartamento-venta-reducto-montevideo-imasuy-r-inmuebles-27392103
"Apartamento En Venta, 2 Dormitorios, La Blanqueada, Terraza",Joaquin Vleazco y Dr. Francisco Simón,U$S 140.000,Venta,La Blanqueada,2 dormitorios,1 Baños,50 Mts,https://www.gallito.com.uy/apartamento-en-venta-2-dormitorios-la-blanqueada-terraza-inmuebles-27245518
VENTA APARTAMENTO 1 DORMITORIO CENTRO,Soriano y Convención,U$S 75.000,Venta,Centro,1 dormitorio,1 Baños,40 Mts,https://www.gallito.com.uy/venta-apartamento-1-dormitorio-centro-inmuebles-27343111
Venta apartamento monoambiente en Cordón,Mercedes y Magallanes,U$S 97.850,Venta,Monoambiente,,1 Baños,46 Mts,https://www.gallito.com.uy/venta-apartamento-monoambiente-en-cordon-inmuebles-27234852
Torre Arenas una nueva forma de vivir en la Rambla de Malvín,18 de Diciembre y Rmabla O´Higgins,U$S 117.500,Venta,Monoambiente,,1 Baños,35 Mts,https://www.gallito.com.uy/torre-arenas-una-nueva-forma-de-vivir-en-la-rambla-de-malvin-inmuebles-15968204
Apartamento a la Venta en Ciudad Vieja,Guarani al 1300,U$S 77.000,Venta,Barrio Sur,1 dormitorio,1 Baños,47 Mts,https://www.gallito.com.uy/apartamento-a-la-venta-en-ciudad-vieja-inmuebles-27149751
Venta excelente apartamento con renta tres dormitorios - Po,Juan Benito Blanco esquina Ramón Masini y uina Ramón Masini,U$S 395.000,Venta,Pocitos,3 dormitorios,3 Baños,112 Mts,https://www.gallito.com.uy/venta-excelente-apartamento-con-renta-tres-dormitorios-po-inmuebles-26346325
Muy Bien Ubicado. Piso 3º,German Barbato y 18 de Julio,U$S 125.000,Venta,Centro,3 dormitorios,1 Baños,69 Mts,https://www.gallito.com.uy/muy-bien-ubicado-piso-3-inmuebles-27438616
EXCELENTE APTO FTE 2 DOR CON TZA  PROX PZA ITALIA MUY LUMINO,COLOMBES y AV ITALIA,U$S 165.000,Venta,Malvin,2 dormitorios,1 Baños,55 Mts,https://www.gallito.com.uy/excelente-apto-fte-2-dor-con-tza-prox-pza-italia-muy-lumino-inmuebles-26863881
"Apartamento 1 dormitorio con Renta, excelente ubicación",Mario Cassinoni y José Enrique Rodó,U$S 65.000,Venta,Cordon,1 dormitorio,1 Baños,70 Mts,https://www.gallito.com.uy/apartamento-1-dormitorio-con-renta-excelente-ubicacion-inmuebles-23378167
Monoambiente en Venta - Punta Carretas,"Doctor José María Montero & Rambla Mahatma Gandhi, Montevideo Departam y Punta Carretas",U$S 105.000,Venta,Monoambiente,,1 Baños,21 Mts,https://www.gallito.com.uy/monoambiente-en-venta-punta-carretas-inmuebles-27378985
VENTA APARTAMENTO 3 DORMITORIOS POCITOS,... y Pocitos Nuevo,U$S 380.000,Venta,Pocitos Nuevo,3 dormitorios,1 Baños,135 Mts,https://www.gallito.com.uy/venta-apartamento-3-dormitorios-pocitos-inmuebles-12044862
VENTA APARTAMENTO 2 DORMITORIOS UN BAÑO PRIMER PISO POR ESC,Propios y Av. ITALIA,U$S 155.000,Venta,La Blanqueada,2 dormitorios,1 Baños,74 Mts,https://www.gallito.com.uy/venta-apartamento-2-dormitorios-un-baño-primer-piso-por-esc-inmuebles-27003024
Apartamento en Pocitos,Canelones y Br Artigas,U$S 298.000,Venta,Pocitos,3 dormitorios,3 Baños,100 Mts,https://www.gallito.com.uy/apartamento-en-pocitos-inmuebles-27473360
Venta de apartamento un dormitorio en Cordón con renta,Unidad 1203- CON RENTA,U$S 148.000,Venta,Cordon,1 dormitorio,1 Baños,64 Mts,https://www.gallito.com.uy/venta-de-apartamento-un-dormitorio-en-cordon-con-renta-inmuebles-24867688
Casa en venta Buceo Sur,Rizal y Cercana a Rambla,U$S 230.000,Venta,Buceo,2 dormitorios,2 Baños,70 Mts,https://www.gallito.com.uy/casa-en-venta-buceo-sur-inmuebles-26725344
Venta de apartamento en Punta Carretas,Punta Carretas,U$S 470.000,Venta,Golf,2 dormitorios,3 Baños,191 Mts,https://www.gallito.com.uy/venta-de-apartamento-en-punta-carretas-inmuebles-27037427
Proyecto en Br. España y Roque Graseras Jardín Castellanos,Roque Graseras 868 y Br. España,U$S 218.000,Venta,Pocitos,1 dormitorio,1 Baños,64 Mts,https://www.gallito.com.uy/proyecto-en-br-españa-y-roque-graseras-jardin-castellanos-inmuebles-23397574
"Venta Local Comercial con Galpón, Oficina y Vivienda en ...",Hocquart 2028 y Esquina,U$S 395.000,Venta,La Comercial,,3 Baños,978 Mts,https://www.gallito.com.uy/venta-local-comercial-con-galpon-oficina-y-vivienda-en-inmuebles-26458122
Sobre Avda Brasil casi Rambla con garage,Avda Brasil y Lázaro Gadea,U$S 299.000,Venta,Pocitos,3 dormitorios,2 Baños,104 Mts,https://www.gallito.com.uy/sobre-avda-brasil-casi-rambla-con-garage-inmuebles-26989618
Se vende lindo apartamento en Reducto,Antonio Machado y Av. Burgues,U$S 95.000,Venta,Reducto,2 dormitorios,1 Baños,61 Mts,https://www.gallito.com.uy/se-vende-lindo-apartamento-en-reducto-inmuebles-27442461
"IMPERAL VENDE..CASA 3 DORM,  COCHERA Y APTO 1 DORMITORIO.",AV.JOSE BELLONI y HUNGRIA,U$S 85.000,Venta,Maroñas,3 dormitorios,1 Baños,580 Mts,https://www.gallito.com.uy/imperal-vendecasa-3-dorm-cochera-y-apto-1-dormitorio-inmuebles-26989428
"Hermosa casa domótica en Carrasco Sur, a metros",Bolonia y Av Italia,U$S 580.000,Venta,Carrasco,3 dormitorios,3 Baños,600 Mts,https://www.gallito.com.uy/hermosa-casa-domotica-en-carrasco-sur-a-metros-inmuebles-26325351
Casa en venta de tres dormitorios en Belvedere,Blvr Manuel Herrera y Obes y Ángel Salvo,U$S 87.000,Venta,Belvedere,3 dormitorios,1 Baños,79 Mts,https://www.gallito.com.uy/casa-en-venta-de-tres-dormitorios-en-belvedere-inmuebles-27325204
Casa en venta de 2 dormitorios en Reducto,Dr. Evaristo Ciganda 1300 y Esquina,U$S 85.000,Venta,Reducto,2 dormitorios,1 Baños,67 Mts,https://www.gallito.com.uy/casa-en-venta-de-2-dormitorios-en-reducto-inmuebles-27383335
OFICINA EN VENTA. 5 AMBIENTES ZONA CIUDAD VIEJA,... y Ciudad Vieja,U$S 114.000,Venta,Ciudad Vieja,,2 Baños,104 Mts,https://www.gallito.com.uy/oficina-en-venta-5-ambientes-zona-ciudad-vieja-inmuebles-25519202
"Venta  apartamento  de 2 dormitorios, alquilado.  Belvedere",Carlos María de Pena al 4600,U$S 75.000,Venta,Belvedere,2 dormitorios,1 Baños,62 Mts,https://www.gallito.com.uy/venta-apartamento-de-2-dormitorios-alquilado-belvedere-inmuebles-20655593
Completamente Reciclada Con 3 Garages,Juan Carlos Gómez y Peatonal Sarandí,U$S 155.000,Venta,Ciudad Vieja,,1 Baños,81 Mts,https://www.gallito.com.uy/completamente-reciclada-con-3-garages-inmuebles-27514170
